{
  "version": "0.0.0-SENTINEL",
  "command": "lineage",
  "model": "revenue_summary",
  "columns": [
    {
      "name": "customer_id"
    },
    {
      "name": "total_revenue"
    },
    {
      "name": "order_count",
      "data_type": "INT64"
    },
    {
      "name": "avg_order_value"
    },
    {
      "name": "first_order"
    }
  ],
  "upstream": [
    "customer_orders"
  ],
  "downstream": [],
  "edges": [
    {
      "source": {
        "model": "customer_orders",
        "column": "customer_id"
      },
      "target": {
        "model": "revenue_summary",
        "column": "customer_id"
      },
      "transform": "direct"
    },
    {
      "source": {
        "model": "customer_orders",
        "column": "total_revenue"
      },
      "target": {
        "model": "revenue_summary",
        "column": "total_revenue"
      },
      "transform": "direct"
    },
    {
      "source": {
        "model": "customer_orders",
        "column": "order_count"
      },
      "target": {
        "model": "revenue_summary",
        "column": "order_count"
      },
      "transform": "direct"
    },
    {
      "source": {
        "model": "customer_orders",
        "column": "total_revenue"
      },
      "target": {
        "model": "revenue_summary",
        "column": "avg_order_value"
      },
      "transform": "expression"
    },
    {
      "source": {
        "model": "customer_orders",
        "column": "order_count"
      },
      "target": {
        "model": "revenue_summary",
        "column": "avg_order_value"
      },
      "transform": "expression"
    },
    {
      "source": {
        "model": "customer_orders",
        "column": "first_order"
      },
      "target": {
        "model": "revenue_summary",
        "column": "first_order"
      },
      "transform": "direct"
    }
  ],
  "nodes": [
    {
      "model": "revenue_summary",
      "target_schema": "gold"
    },
    {
      "model": "customer_orders",
      "target_schema": "silver"
    }
  ],
  "incomplete_lineage": []
}
